{"$schema":"https://json-schema.org/draft/2020-12/schema","title":"ME2 public questions","type":"array","items":{"type":"object","required":["id","examId","section","number","category","choiceCount","points"],"properties":{"id":{"type":"string"},"examId":{"type":"string"},"section":{"type":"string"},"number":{"type":"integer","minimum":1},"category":{"type":"string"},"choiceCount":{"type":"integer","minimum":2},"points":{"type":"number","exclusiveMinimum":0}},"not":{"anyOf":[{"required":["correctAnswers"]},{"required":["scoring"]},{"required":["explanation"]}]}}}
